Cond1,Cond2,jaccard_distance,Shared,NotShared_cond1,NotShared_cond2,Total_Genes_Cond1,Total_Genes_Cond2,Genes_Names,Percentage_Shared_Cond1,Percentage_Shared_Cond2,pvalue,-log(p)
ARPP,LEUKOCYTES,0.156,223,96,1110,1053,7419,"THEMIS, NFKBIA, TLR5, HLA-DRA, CD4, PRKCQ, CD247, FCGR1B, CCR7, TLR6, TLR2, FCER1G, TRAT1, LILRB2, LILRB1, CLEC7A, BTLA, FGR, CD86, GRAP2, HLA-DQB1, ZAP70, MNDA, IRAK3, DUSP6, PAK1, CTSH, CTLA4, TLR4, CSK, FOS, LAT2, CARD11, UBASH3A, TLR7, LY96, HCK, LYN, MAPK14, MYD88, ITK, SLA2, KLRK1, HLA-DMB, HLA-DQA1, MEF2C, SYK, TLR1, HLA-DOA, HLA-DOB, HLA-DMA, HLA-DPA1, CD19, CD3E, BTK, CD3G, CD1D, CD1E, CD1B, CD1C, CD1A, CD36, HLA-DRB4, CYP1B1, PLAUR, PTGS2, RTN1, AGPAT9, SLC27A2, ITGA4, GIMAP6, SELL, IRF8, FGL2, ITGAM, AIF1, ICAM1, HLA-C, HLA-G, HLA-F, HLA-E, TLR8, MBL2, LBP, CD14, MAVS, RIGI, CGAS, STING1, CCR2, CXCR2, CCR1, CXCR4, CXCR1, HMGB1, GPR183, PIK3CG, CCL5, ALOX5, NLRP12, ITGB8, ITGB6, IL13, HAMP, FCGR3A, SLC11A1, TICAM1, IFI35, PRKCE, SFTPD, CCL2, LGALS3, AZU1, CCL3, CSF1, MCOLN2, P0DOX3, CCL3L1, CX3CL1, IL6R, CCL18, CCL1, CCL7, CTSG, XCL1, CCL23, CCL4, CCL4L1, CCL24, CCL20, RPS19, CCL8, S100A12, JAML, SIRPA, PECAM1, REG3G, TIRAP, HLA-DRB3, SPI1, NOTCH2, LTBR, RELB, RBPJ, LACC1, IRGM, TNFAIP3, CASP1, LAG3, RNF135, KLRC1, CLEC6A, KLRC2, KLRC3, SRC, BCL10, CTSS, TICAM2, CD40, DDX58, IRF7, ZBP1, AIM2, IL6, PYCARD, CXCL10, IL1B, FCGR1A /// FCGR1C, HSPA6, NCF4, C5AR1, APOB48R, LILRB3, KCNJ15, PILRA, TYROBP, MGAM, P2RY13, NFE2, FPR2, SIGLEC9, FCAR, DYSF, NPL, FPR1, FCGR2C, AQP9, FES, CSF3R, ITGAX, KCNJ2, WDFY3, BST1, ANPEP, LILRA6, PADI4, SLC40A1, TNFSF13B, ASGR1, ASGR2, PCTP, AP1S2, BCL6, IL1R2, TBXAS1, DHX58, TRIM25, IFIH1, TNF, ISG15, IL8, TAP1, KYNU, LY86, THBS1, PSMB8, EREG, BST2, USP18, RIPK2, CXCL16, PSMB10, IFIT2",21.18,3.01,9.065098258454392e-69,68.04262748413623
ARPP,CELLULAR ADAPTIVE IMMUNE SYSTEM,0.137,94,225,369,1053,1506,"NCKAP1L, THEMIS, JUN, PTPN6, HLA-DRA, CD4, PRKCQ, PLCG1, CD247, TRBC1, CCR7, FCER1G, TRAT1, LILRB2, LILRB1, FYN, CD86, GRAP2, ZAP70, LCK, PTPN22, CTSH, CTLA4, TLR4, CSK, FOS, HLA-DRB1, CD24, UBASH3A, LIME1, MAPK14, ITK, TRAC, SLA2, KLRK1, SYK, PTPRC, CD3D, CD3E, BTK, CD3G, CD1D, CD1C, CD8A, ITPR3, ITGA4, GIMAP6, SELL, ITGAL, ITGAM, AIF1, HLA-E, WDFY4, CCR2, HMGB1, GPR183, PIK3CG, CCL5, F2R, DOCK8, IL13, HAMP, JMJD6, SLC11A1, IL33, PLCG2, CCL2, AZU1, CCL3, LIPA, CX3CL1, IL6R, XCL1, CCL20, JAML, HSPD1, HLA-DRB3, SPI1, PSEN1, RELB, LAG3, PHB1, KLRC1, SRC, NAGLU, FOSL1, BCL10, C5AR1, LILRB3, TYROBP, SLC40A1, BCL6, TNF, PSMB10",8.93,6.24,2.07703917174245e-105,104.68255531284807
ARPP,COMPLEMENT,0.014,5,314,37,1053,153,"MBL2, IL33, C5AR1, FPR2, FPR1",0.47,3.27,3.2107282587749697e-45,44.49339644955917
ARPP,DENDRITIC CELL,0.12,61,258,190,1053,810,"NFKBIA, CCR7, CD86, HLA-DQB1, LY96, HLA-DQA1, HLA-DMA, CD1E, CD1B, CD1C, CD1A, AGPAT9, IRF8, ICAM1, TLR8, CCR2, CXCR2, CCR1, CXCR4, CXCR1, HMGB1, GPR183, PIK3CG, CCL5, F2R, ALOX5, CDC42, EPS8, DOCK8, NLRP12, TGFBR2, ITGB8, CCL4, CCL20, CCL8, SIRPA, HLA-DRB3, ARHGEF5, SPI1, BATF2, NOTCH2, LTBR, PSEN1, RELB, RBPJ, LAG3, ZBTB46, CD40, DDX58, IRF7, IL1B, TYROBP, ITGAX, ANPEP, TNFSF13B, IL1R2, IFIH1, TNF, EREG, CXCL16, IFIT2",5.79,7.53,4.056602741431879e-86,85.3918375201861
ARPP,EOSINOPHIL,0.052,17,302,5,1053,66,"BTK, CCL5, CCL2, LGALS3, CCL3, CCL3L1, CX3CL1, CCL18, CCL1, CCL7, XCL1, CCL23, CCL4, CCL4L1, CCL24, CCL8, MPL",1.61,25.76,9.129345900624917e-7,6.039560337682082
ARPP,HUMORAL ADAPTIVE IMMUNE SYSTEM,0.096,78,241,494,1053,1785,"NCKAP1L, HLA-DPB1, NFKBIA, PTPN6, HLA-DRA, CCR7, TLR10, FCER1G, BTLA, FGR, CD86, ZAP70, MNDA, DUSP6, CTLA4, TLR4, CD24, HCK, LYN, INPP5D, ITK, HLA-DQA1, MEF2C, SYK, PTPRC, HLA-DOA, HLA-DOB, HLA-DMA, HLA-DPA1, CD19, BTK, ITGA4, IRF8, HLA-G, HLA-E, MBL2, LBP, CCR2, CXCR4, GPR183, ALOX5, ITGB6, HAMP, SLC11A1, TICAM1, PRKCE, PLCG2, CCL2, LGALS3, AZU1, EDNRB, LIPA, CCL18, CCL1, CTSG, XCL1, CCL20, RPS19, CCL8, S100A12, MPL, REG3G, HSPD1, SPI1, NOTCH2, RBPJ, TNFAIP3, PHB1, EP300, SRC, BCL10, CD40, BST1, BCL6, TNF, LY86, BST2, PSMB10",7.41,4.37,4.8076494023205725e-138,137.31806721076182
ARPP,IMMUNOGLOBULIN MEDIATED RESPONSE,0.09,39,280,116,1053,465,"NCKAP1L, NFKBIA, PTPN6, FCER1G, FGR, CD86, ZAP70, MNDA, CTLA4, TLR4, HCK, ITK, MEF2C, SYK, PTPRC, CD19, BTK, ITGA4, IRF8, HLA-G, MBL2, LBP, GPR183, TICAM1, PRKCE, PLCG2, MPL, HSPD1, SPI1, NOTCH2, RBPJ, TNFAIP3, PHB1, EP300, SRC, BCL10, CD40, BCL6, BST2",3.7,8.39,4.445439527749031e-72,71.35208529317764
ARPP,INFLAMMATION,0.051,18,301,37,1053,228,"NFKBIA, FCER1G, PAK1, TLR4, AIF1, CXCR2, HMGB1, LIPA, CCL4, CCL20, NOTCH2, RBPJ, TNFAIP3, IL1B, APOB48R, TYROBP, TNF, RIPK2",1.71,7.89,5.438088512717973e-37,36.264553727923186
ARPP,INNATE IMMUNE SYSTEM,0.258,319,0,918,1053,4113,"NCKAP1L, THEMIS, HLA-DPB1, JUN, NFKBIA, PTPN6, TLR5, HLA-DRA, CD4, PRKCQ, PLCG1, CD247, TRBC1, FCGR1B, CCR7, TLR6, TLR10, FYB, TLR2, FCER1G, TRAT1, LILRB2, LILRB1, CLEC7A, BTLA, FYN, FGR, CD86, GRAP2, HLA-DQB1, ZAP70, PAG1, MNDA, IRAK3, LCK, DUSP6, PTPN22, PAK1, CTSH, CTLA4, LCP2, TLR4, CSK, FOS, LAT2, CARD11, HLA-DRB1, CHUK, CD24, UBASH3A, MAP2K6, TLR7, LY96, HCK, VASP, LYN, LIME1, MAPK14, MYD88, INPP5D, ITK, TRAC, SLA2, KLRK1, HLA-DMB, RPS6KA1, HLA-DQA1, MEF2C, SYK, MEF2A, TLR1, PTPRC, HLA-DOA, HLA-DOB, HLA-DMA, HLA-DPA1, CD19, CD3D, CD3E, BTK, CD3G, CD1D, CD1E, CD1B, CD1C, CD1A, CD36, HLA-DRB4, CD8A, CD74, CYP1B1, PLAUR, PTGS2, HMOX1, ASPH, RTN1, FAR2, ITPR3, AGPAT9, SLC27A2, CD53, IL10RA, ITGA4, HLA-DRB1 /// HLA-DRB4, HLA-DRB1 /// HLA-DRB4 /// HLA-DRB5, HLA-DRB1 /// HLA-DRB3 /// HLA-DRB4, HCLS1, ITGB2, GIMAP6, EVI2B, PLEK, SLA, SELL, IRF8, FGL2, ITGAL, ITGAM, AIF1, ICAM1, LAPTM5, HLA-C, HLA-B, HLA-A, HLA-G, HLA-F, HLA-E, TLR8, LOC100294224, WDFY4, LOC100294318, LOC100294317, METTL7A, HLA-DQA2, MBL2, LBP, CD14, MAVS, RIGI, CGAS, STING1, CCR2, CXCR2, CCR1, CXCR4, CXCR1, HMGB1, GPR183, PIK3CG, CCL5, F2R, ALOX5, CDC42, EPS8, DOCK8, NLRP12, TGFBR2, ITGB8, ITGB6, IL13, HAMP, CRTC3, JMJD6, FCGR3A, TMEM229B, SLC11A1, ADGRF5, EDN2, TICAM1, IFI35, IL33, PRKCE, PLCG2, SFTPD, CCL2, LGALS3, AZU1, EDNRB, RPL13A, CXCL17, SAA1, CCL3, MMP2, LIPA, CSF1, ROR2, MCOLN2, BCR, B4GALT1, HYAL2, MT1G, SPACA3, P0DOX3, CCL3L1, CX3CL1, IL6R, CCL18, CCL1, CCL7, CTSG, XCL1, CCL23, FLT1, CCL4, CCL4L1, CCL24, CCL20, RPS19, CCL8, S100A12, JAML, SIRPA, PECAM1, MPL, REG3G, HSPD1, TIRAP, HLA-DRB3, ARHGEF5, SPI1, BATF2, NOTCH2, LTBR, PSEN1, RELB, RBPJ, XIAP, LACC1, IRGM, RELA, TNFAIP3, CASP1, LAG3, ZBTB46, RNF135, PHB1, LSM14A, KLRC1, EP300, CLEC6A, KLRC2, KLRC3, SRC, PIK3AP1, TNIP2, SCIMP, NAGLU, AP3B1, FOSL1, RPS6KA3, MAPKAPK2, BCL10, CTSS, TICAM2, RAB11FIP2, CD40, DDX58, IRF7, ZBP1, AIM2, IL6, PYCARD, CXCL10, IL1B, FCGR1A /// FCGR1C, HSPA6, NCF4, C5AR1, APOB48R, LILRB3, KCNJ15, PILRA, TYROBP, MGAM, P2RY13, NFE2, FPR2, SIGLEC9, FCAR, DYSF, NPL, FPR1, FCGR2C, AQP9, FES, CSF3R, ITGAX, KCNJ2, WDFY3, BST1, ANPEP, LILRA6, PADI4, SLC40A1, TNFSF13B, ASGR1, ASGR2, PCTP, AP1S2, BCL6, IL1R2, TBXAS1, DHX58, TRIM25, IFIH1, TNF, ISG15, IL8, TAP1, KYNU, LY86, THBS1, PSMB8, EREG, BST2, USP18, RIPK2, CXCL16, PSMB10, IFIT2",30.29,7.76,1,-0
ARPP,LYMPHOCYTE,0.024,9,310,61,1053,210,"TRAT1, CTLA4, UBASH3A, MEF2C, CD19, CD3E, CD3G, CD1B, CCL4",0.85,4.29,2.3125351093371763e-61,60.63591166499946
ARPP,MACROPHAGE,0.11,35,284,0,1053,105,"TLR4, SYK, LBP, CCR2, CCL5, IL13, HAMP, CRTC3, JMJD6, FCGR3A, TMEM229B, SLC11A1, ADGRF5, EDN2, TICAM1, IFI35, IL33, PRKCE, PLCG2, SFTPD, CCL2, LGALS3, AZU1, EDNRB, RPL13A, CXCL17, SAA1, CCL3, MMP2, LIPA, CSF1, ROR2, MCOLN2, BCR, B4GALT1",3.32,33.33,1,-0
ARPP,MAST CELL,0.012,4,315,20,1053,72,"SYK, BTK, PIK3CG, S100A12",0.38,5.56,1.1395055812303518e-28,27.943283543329933
ARPP,MONOCYTE,0.206,112,207,225,1053,1029,"TLR5, CD4, FCGR1B, TLR2, FCER1G, LILRB2, LILRB1, CLEC7A, FGR, CD86, MNDA, IRAK3, DUSP6, PAK1, CTSH, TLR4, FOS, LAT2, LY96, HCK, LYN, HLA-DMB, SYK, TLR1, BTK, CD1D, CD36, HLA-DRB4, CYP1B1, PLAUR, PTGS2, RTN1, AGPAT9, FGL2, ITGAM, AIF1, TLR8, CD14, CCR2, CXCR2, CCR1, CCL5, ALOX5, NLRP12, SLC11A1, CCL2, LGALS3, AZU1, CCL3, CSF1, HYAL2, MT1G, SPACA3, P0DOX3, CCL3L1, CX3CL1, IL6R, CCL18, CCL1, CCL7, CTSG, XCL1, CCL23, FLT1, CCL4, CCL4L1, CCL24, CCL20, RPS19, CCL8, S100A12, JAML, SIRPA, PECAM1, MPL, SPI1, LTBR, CTSS, PYCARD, IL1B, HSPA6, C5AR1, APOB48R, LILRB3, PILRA, TYROBP, MGAM, P2RY13, NFE2, FPR2, SIGLEC9, FCAR, DYSF, FPR1, AQP9, FES, CSF3R, ITGAX, BST1, ANPEP, LILRA6, PADI4, SLC40A1, TNFSF13B, ASGR1, ASGR2, BCL6, IL1R2, TBXAS1, IL8, KYNU, LY86",10.64,10.88,1.753694886649581e-67,66.75604596431715
ARPP,MYELOID CELL,0.037,14,305,61,1053,225,"TLR5, FCER1G, CD86, TLR4, TLR7, CD1D, TLR8, CD14, CCR2, CCR1, IL6, ASGR1, BCL6, THBS1",1.33,6.22,1.993653613423661e-57,56.70035029579692
ARPP,NEUTROPHIL,0.127,53,266,98,1053,462,"NCKAP1L, FCER1G, SYK, BTK, LBP, CCR2, CXCR2, CXCR1, HMGB1, PIK3CG, CCL5, NLRP12, FCGR3A, EDN2, CCL2, LGALS3, AZU1, SAA1, CCL3, CSF1, MCOLN2, BCR, CCL3L1, CX3CL1, IL6R, CCL18, CCL1, CCL7, CTSG, XCL1, CCL23, CCL4, CCL4L1, CCL24, CCL20, CCL8, S100A12, JAML, PECAM1, MPL, HSPA6, NCF4, C5AR1, KCNJ15, TYROBP, MGAM, NFE2, FPR2, FCAR, NPL, FPR1, CSF3R, SLC40A1",5.03,11.47,8.320554521835595e-57,56.07984772926839
ARPP,NK CELL,0.043,19,300,120,1053,432,"PTPN6, PRKCQ, CD247, ZAP70, CARD11, ITK, KLRK1, PTPRC, GIMAP6, HLA-E, PIK3CG, CCL5, FCGR3A, XCL1, CCL4, LAG3, KLRC1, KLRC2, KLRC3",1.8,4.4,4.085288791425495e-88,87.3887772375185
ARPP,SIGNALING,0.074,31,288,98,1053,387,"NFKBIA, CCR7, DUSP6, HCK, MAPK14, ICAM1, CCR1, CXCR4, CCL5, CCL2, CCL18, CCL1, CCL7, XCL1, CCL23, CCL4, CCL20, CCL8, TNFAIP3, DDX58, IRF7, IL6, CXCL10, IL1B, BCL6, DHX58, IFIH1, TNF, IL8, TAP1, USP18",2.94,8.01,2.494216853260429e-68,67.60306579060077
ARPP,T CELL,0.129,86,233,346,1053,1500,"NCKAP1L, THEMIS, JUN, PTPN6, HLA-DRA, CD4, PRKCQ, PLCG1, CD247, TRBC1, CCR7, FCER1G, TRAT1, LILRB2, LILRB1, FYN, CD86, GRAP2, ZAP70, LCK, PTPN22, CTSH, CTLA4, TLR4, CSK, FOS, HLA-DRB1, CD24, UBASH3A, LIME1, MAPK14, ITK, TRAC, SLA2, KLRK1, SYK, PTPRC, CD3D, CD3E, BTK, CD3G, CD1D, CD1C, CD8A, ITPR3, ITGA4, GIMAP6, SELL, ITGAL, HLA-E, WDFY4, CCR2, HMGB1, GPR183, PIK3CG, CCL5, F2R, DOCK8, JMJD6, SLC11A1, IL33, PLCG2, CCL2, CCL3, LIPA, IL6R, XCL1, CCL20, JAML, HSPD1, HLA-DRB3, SPI1, PSEN1, RELB, LAG3, PHB1, KLRC1, SRC, FOSL1, BCL10, LILRB3, TYROBP, SLC40A1, BCL6, TNF, PSMB10",8.17,5.73,7.685015210844199e-107,106.11435526857034
B CELL,ADAPTIVE IMMUNE SYSTEM,0.498,473,476,0,3078,1650,"CD52, CCR7, HLA-DRA, ZAP70, ITK, IL2RG, PTPRC, IL7R, RASGRP1, BCL11B, CD27, GATA3, MS4A1, SP140, CD24, BCL2, TNF, IL2RB, CXADR, CD40LG, ITGA4, VCAM1, CD37, SPI1, PTPN6, JAK3, TCF4, CTLA4, FCER2, IGHD, BLK, CD200, KIT, CD79A, MEF2C, GAB1, BANK1, CD19, PTK2, EBF1, ICOSLG, VPREB1, VPREB3, LOC100130458, TCL1A, FAM150B, TNFSF13, LIF, HHEX, CEBPE, CBFA2T3, LTA, TLR4, LYN, STAP1, CD72, TSPAN13, BCL11A, C13orf18, KIAA0125, CD79B, P2RX5, BTLA, AFF3, PPAPDC1B, IGHM, LOC90925, FCRLA, SPIB, FAM129C, ABCB4, FCRL1, FCRL5, KLHL14, CXCR5, PCDH9, RALGPS2, CD22, IGH@, IGKV3-20, MACROD2, PNOC, ADAM28, LOC283663, CR2, PAX5, E2F5, PLEKHG1, PKIG, FCRL2, IGLJ3, HLA-DOB, PTPRK, IGHA1, LOC642838, LOC642424, IGK@, TPD52, CDK14, BLNK, FCGR2B, CELSR1, DENND5B, PAWR, CD180, LOC100130100, POU2AF1, FAM30A, KLF8, LOC652493, IGKC, LOC284749, FCRL3, TBC1D9, ALOX5, CD69, FAIM3, IGLV1-44, IGL@, HLA-DOA, HLA-DQA1, BTK, CPNE5, CIITA, TLR10, IGHG1, GPR18, LY9, INPP5D, SYK, PIK3CD, VAV1, PLCG2, PIK3R5, PIK3R3, RAC2, JAM3, NEDD4, GAB2, DUSP6, NR3C2, NRXN3, LY86, HBEGF, LOC144481, NR4A1, DLL1, LOC100288911, NR4A3, IGKV4-1, LOC100287723, LOC100289053, IGKV1D-13, ITM2C, LOC96610, IGLV4-60, IGLV3-19, LOC91316, LOC100290557, IGLV2-23, IGJ, OSBPL10, CYAT1, LOC100293440, TNFRSF17, GNG7, IGLL3, MGC29506, IGLL5, TXNDC5, DERL3, MUTED, IGHV3-48, IGKV1-5, SSPN, AVPR1A, KCNE4, HEPACAM2, GYPA, SEMA4B, EGF, GPR37, C11orf87, USH2A, PPP1R3A, OR12D3, POPDC3, DCC, SLC12A1, GP5, CDH5, SLITRK6, HLA-DPB1, PCDHA3, TRHDE, GHR, TAS2R13, FLRT2, TPTE, TMEM100, GYPE, PLD4, ADAM7, KCNMB3, GPR6, CSPG4, SYT2, ROBO2, FREM2, TRPC1, GPR116, TMEM47, SCN3A, NPY1R, LPPR4, NOX4, PDZK1IP1, CCR9, GABBR1, EDNRB, GJC1, LHCGR, PCDHB8, NT5E, PDPN, PCDHB4, CLDN8, LRRTM4, HRH4, NMBR, NCAM2, GRM5, TM4SF20, IL5RA, JAM2, IL28RA, MC3R, F2RL3, ASTN1, MOGAT2, SLC26A7, SLC24A1, TACR3, IL13RA2, IMPG2, LRRC19, TMEFF2, PCDH10, BTC, GPR98, AGTR1, TMEM133, UGT2A3, OR11A1, CSMD1, TRPC7, CCR6, GABRA5, PLP1, CLCA4, CNR1, EPHA3, SLC30A10, SGCE, CHRNB4, PCDHB10, PCDHB16, PCDHB15, PCDHB14, CADM2, GPR85, SLC6A15, GPR87, NLGN1, SLC13A1, OR1E1, GABRB1, TAAR2, HHLA2, SLC17A6, CNTNAP3, SLC6A16, HLA-DPA1, ABCA8, OR2J2, CHL1, TMEM156, SLC5A7, OR2W1, LPHN3, LPHN2, LRP1B, PCDH20, KCND2, SLC44A5, ITGB6, NLGN4Y, CHRM2, PTH2R, HEPH, BAI3, PTPRR, SELE, FAM26F, SCN1A, HTR1E, HLA-DMA, PPAP2C, KCNG2, SLC5A4, CAV1, TEK, TMEM37, GP1BB, SLC16A14, ICAM2, SLC44A1, CCR10, CHRM1, CLPTM1L, KCNN3, HM13, GPR25, KCNH1, TXNDC15, SDC1, DRD4, KRTCAP2, TRAM2, SCARB2, AMIGO3, LGR4, TRHR, GHSR, P2RY14, SLC38A11, C4orf34, CXCR4, TMEM56, KCNJ16, SLC26A3, MUC15, OR1G1, TAS2R7, HVCN1, GABRE, CLDN17, SORCS3, LINGO1, NKAIN4, TAS2R10, GRAMD1C, TNFRSF13B, ADAM2, GLP2R, ABL1, STAT5B, MYO1G, RAG1, BCL10, TEC, C17orf99, GPR183, IFNA8, BMX, LAX1, CD86, CD81, IFNE, CLEC4G, TICAM1, TBC1D10C, CHRNA4, CD40, GAPT, PHB1, CHRNA7, HSPD1, CHRNB2, TXLNA, BST2, AKAP17A, EPHB2, HDAC4, CH25H, TOP2B, PIK3R1, MSH2, RAG2, ADGRG3, FZD9, EP300, PTPRJ, YY1, PTPN2, LYL1, CEBPG, BCL6, SP3, ZBTB7A, NFAM1, IL10, IL11, TCF3, RBPJ, FOSL2, FLT3, ADAM17, IL9, CDH17, SPNS2, BAX, CAMLG, RC3H1, SOS2, SOS1, NCKAP1L, CASP3, PRKDC, CD70, IL7, PRKCD, CTPS1, CD38, WNT3A, BCAR1, GRB2, MNDA, MAPK1, NFKBIA, NFKB1, TNFAIP3, LIG4, FCER1G, LIMK1, VAV2, SRC, PRKCE, HCK, FGR, PLPP4, IRF8, BCL3, ZP3, IRF2BP2, SYVN1, WNT4, IL4R, IL9R, MPL, CSF2RB, MLH1, ERCC1, UNG, RNF168, SANBR, MSH6, STAT6, LFNG, NOTCH2, ST3GAL1, PTX3, SFTPA1, LBP, C4B, MBL2, HLA-G, LRRC8A, SHLD3, SHLD1, SHLD2, PMS2, MSH3",15.37,28.67,1,-0
B CELL,IMMUNE SYSTEM,0.059,34,99,439,399,1650,"NCKAP1L, HLA-DPB1, NFKBIA, PTPN6, HLA-DRA, CCR7, TLR10, FCER1G, BTLA, FGR, CD86, ZAP70, MNDA, DUSP6, CTLA4, TLR4, CD24, HCK, LYN, INPP5D, ITK, HLA-DQA1, MEF2C, SYK, PTPRC, HLA-DOA, HLA-DOB, HLA-DMA, HLA-DPA1, CD19, BTK, ITGA4, IRF8, HLA-G",8.52,2.06,4.314356481146861e-82,81.36508397342013
B CELL,ANTIMICROBIAL,0.002,1,62,472,189,1650,BCL3,0.53,0.06,5.455110289179509e-81,80.2631964645994
B CELL,ANTIVIRAL & IFN,0.023,14,133,459,453,1650,"PHB1, NMBR, MBL2, TLR4, IRF8, HLA-DPA1, IFNE, HDAC4, IFNA8, HCK, PTX3, BCL3, LHCGR, IMPG2",3.09,0.85,1.084506812228383e-118,117.96476771566094
B CELL,ARPP,0.08,59,260,414,1053,1650,"NCKAP1L, HLA-DPB1, NFKBIA, PTPN6, HLA-DRA, CCR7, TLR10, FCER1G, BTLA, FGR, CD86, ZAP70, MNDA, DUSP6, CTLA4, TLR4, CD24, HCK, LYN, INPP5D, ITK, HLA-DQA1, MEF2C, SYK, PTPRC, HLA-DOA, HLA-DOB, HLA-DMA, HLA-DPA1, CD19, BTK, ITGA4, IRF8, HLA-G, MBL2, LBP, CXCR4, GPR183, ALOX5, ITGB6, TICAM1, PRKCE, PLCG2, EDNRB, MPL, HSPD1, SPI1, NOTCH2, RBPJ, TNFAIP3, PHB1, EP300, SRC, BCL10, CD40, BCL6, TNF, LY86, BST2",5.6,3.58,3.872045676760225e-141,140.41205952815912
B CELL,LEUKOCYTES,0.081,136,337,1197,1650,7419,"TNFSF13, LIF, HHEX, CEBPE, SPI1, TLR4, CCR7, LYN, TNF, BLK, CD72, CD200, CD79B, VPREB3, CD79A, BTLA, LOC90925, LOC100130458, BANK1, MS4A1, CXCR5, CD22, TCL1A, IGHD, MACROD2, EBF1, CR2, PAX5, FCER2, HLA-DOB, CD19, CDK14, FCGR2B, IGKC, MEF2C, ALOX5, HLA-DOA, HLA-DQA1, BTK, CIITA, GPR18, SYK, VAV1, JAM3, BCL2, DUSP6, LY86, ICOSLG, GAB1, DLL1, FAM150B, BCL11B, VPREB1, EGF, CCR9, PDPN, JAM2, HLA-DPA1, HLA-DRA, ITGB6, SELE, HLA-DMA, CXCR4, TNFRSF17, TICAM1, CD40, LAX1, RASGRP1, ZAP70, CD86, BST2, GPR183, CH25H, IFNA8, PIK3R1, RAG1, MSH2, IL2RG, CEBPG, JAK3, BCL6, KIT, NFAM1, ITGA4, CD40LG, IL10, RBPJ, IFNE, FLT3, VCAM1, IL9, SPNS2, BAX, IL7R, RC3H1, SOS1, PRKDC, CD70, IL7, PRKCD, CTPS1, CD38, BCAR1, CTLA4, MNDA, ITK, BMX, NFKBIA, TEC, NFKB1, TNFAIP3, SRC, PRKCE, MYO1G, HCK, PTK2, FGR, IRF8, BCL3, CD81, CLEC4G, IL4R, BCL10, FCER1G, IL2RB, CSF2RB, UNG, NOTCH2, C17orf99, PTX3, LBP, C4B, MBL2, HLA-G, GATA3, CCR10",8.24,1.83,5.390688287544872e-242,241.26835578019382
B CELL,CELLULAR ADAPTIVE IMMUNE SYSTEM,0.092,79,394,384,1650,1506,"SPI1, TLR4, CCR7, TNF, MS4A1, TCF4, CD24, CR2, SP140, BTK, CD37, SYK, VAV1, PLCG2, PTPN6, BCL2, BCL11B, CXADR, CD52, HLA-DRA, PHB1, CHRNA7, RASGRP1, HSPD1, ZAP70, CD86, GPR183, PTPRC, IFNA8, PIK3R1, RAG1, RAG2, IL2RG, PTPRJ, STAT5B, PTPN2, JAK3, BCL6, KIT, SP3, ITGA4, CD40LG, IL10, FOSL2, IFNE, VCAM1, ADAM17, SPNS2, BAX, IL7R, RC3H1, NCKAP1L, CASP3, PRKDC, CD70, ABL1, IL7, CTPS1, BCAR1, CTLA4, ITK, MAPK1, TEC, SRC, MYO1G, BCL3, CD81, WNT4, CLEC4G, IL4R, BCL10, FCER1G, IL2RB, CD27, LIG4, STAT6, LFNG, GATA3, CAV1",4.79,5.25,1.4598016646159984e-164,163.83570614545803
B CELL,COMPLEMENT,0.006,3,470,39,1650,153,"CR2, C4B, MBL2",0.18,1.96,2.253786258223151e-55,54.64708727341671
B CELL,DENDRITIC CELL,0.03,21,452,230,1650,810,"SPI1, CCR7, TNF, IGKC, ALOX5, HLA-DQA1, HLA-DMA, CXCR4, CD40, CD86, GPR183, CH25H, RBPJ, VCAM1, PRKCD, CD38, NFKBIA, IRF8, BCL3, CSF2RB, NOTCH2",1.27,2.59,6.343823100891758e-162,161.19764893593285
B CELL,EOSINOPHIL,0.004,2,471,20,1650,66,"BTK, MPL",0.12,3.03,1.1545820860257638e-33,32.93757518510217
B CELL,HUMORAL ADAPTIVE IMMUNE SYSTEM,0.827,473,0,99,1650,1785,"TNFSF13, LIF, HHEX, CEBPE, CBFA2T3, LTA, SPI1, TLR4, CCR7, LYN, TNF, STAP1, BLK, CD72, TSPAN13, BCL11A, C13orf18, KIAA0125, CD200, CD79B, VPREB3, CD79A, P2RX5, BTLA, AFF3, PPAPDC1B, IGHM, LOC90925, FCRLA, SPIB, FAM129C, ABCB4, LOC100130458, FCRL1, BANK1, MS4A1, FCRL5, TCF4, KLHL14, CXCR5, PCDH9, RALGPS2, CD22, TCL1A, CD24, IGH@, IGKV3-20, IGHD, MACROD2, EBF1, PNOC, ADAM28, LOC283663, CR2, PAX5, E2F5, PLEKHG1, FCER2, PKIG, FCRL2, IGLJ3, HLA-DOB, PTPRK, CD19, IGHA1, LOC642838, LOC642424, IGK@, TPD52, CDK14, BLNK, SP140, FCGR2B, CELSR1, DENND5B, PAWR, CD180, LOC100130100, POU2AF1, FAM30A, KLF8, LOC652493, IGKC, MEF2C, LOC284749, FCRL3, TBC1D9, ALOX5, CD69, FAIM3, IGLV1-44, IGL@, HLA-DOA, HLA-DQA1, BTK, CPNE5, CIITA, TLR10, IGHG1, GPR18, LY9, CD37, INPP5D, SYK, PIK3CD, VAV1, PLCG2, PIK3R5, PIK3R3, RAC2, PTPN6, JAM3, NEDD4, GAB2, BCL2, DUSP6, NR3C2, NRXN3, LY86, ICOSLG, HBEGF, LOC144481, NR4A1, GAB1, DLL1, LOC100288911, NR4A3, FAM150B, BCL11B, VPREB1, SSPN, AVPR1A, KCNE4, HEPACAM2, GYPA, SEMA4B, EGF, GPR37, C11orf87, USH2A, PPP1R3A, OR12D3, POPDC3, DCC, SLC12A1, GP5, CDH5, SLITRK6, HLA-DPB1, PCDHA3, TRHDE, GHR, TAS2R13, FLRT2, TPTE, TMEM100, GYPE, PLD4, ADAM7, KCNMB3, GPR6, CSPG4, SYT2, ROBO2, FREM2, TRPC1, GPR116, TMEM47, SCN3A, NPY1R, LPPR4, NOX4, PDZK1IP1, CCR9, GABBR1, EDNRB, GJC1, LHCGR, PCDHB8, NT5E, PDPN, PCDHB4, CLDN8, LRRTM4, HRH4, NMBR, NCAM2, GRM5, TM4SF20, IL5RA, JAM2, IL28RA, MC3R, F2RL3, ASTN1, MOGAT2, SLC26A7, SLC24A1, TACR3, IL13RA2, IMPG2, LRRC19, TMEFF2, ITM2C, PCDH10, BTC, GPR98, AGTR1, TMEM133, UGT2A3, OR11A1, CSMD1, TRPC7, CCR6, GABRA5, PLP1, CLCA4, CNR1, EPHA3, SLC30A10, SGCE, CHRNB4, PCDHB10, PCDHB16, PCDHB15, PCDHB14, CADM2, GPR85, SLC6A15, GPR87, NLGN1, SLC13A1, OR1E1, GABRB1, CXADR, TAAR2, HHLA2, SLC17A6, CNTNAP3, SLC6A16, HLA-DPA1, ABCA8, CD52, OR2J2, CHL1, TMEM156, SLC5A7, OR2W1, LPHN3, LPHN2, HLA-DRA, LRP1B, PCDH20, KCND2, SLC44A5, ITGB6, NLGN4Y, CHRM2, PTH2R, HEPH, BAI3, PTPRR, SELE, FAM26F, SCN1A, HTR1E, HLA-DMA, LGR4, TRHR, GHSR, P2RY14, SLC38A11, C4orf34, CXCR4, TMEM56, KCNJ16, SLC26A3, MUC15, OR1G1, TAS2R7, HVCN1, GABRE, CLDN17, SORCS3, TNFRSF17, LINGO1, NKAIN4, TAS2R10, GRAMD1C, TNFRSF13B, ADAM2, GLP2R, TICAM1, TBC1D10C, CHRNA4, CD40, GAPT, PHB1, CHRNA7, LAX1, RASGRP1, HSPD1, ZAP70, CD86, CHRNB2, TXLNA, BST2, AKAP17A, EPHB2, HDAC4, GPR183, CH25H, PTPRC, TOP2B, IFNA8, PIK3R1, RAG1, MSH2, RAG2, IL2RG, ADGRG3, FZD9, EP300, PTPRJ, YY1, STAT5B, PTPN2, LYL1, CEBPG, JAK3, BCL6, KIT, SP3, ZBTB7A, NFAM1, ITGA4, CD40LG, IL10, IL11, TCF3, RBPJ, FOSL2, IFNE, FLT3, VCAM1, ADAM17, IL9, CDH17, SPNS2, BAX, CAMLG, IL7R, RC3H1, SOS2, SOS1, NCKAP1L, CASP3, PRKDC, CD70, ABL1, IL7, PRKCD, CTPS1, CD38, WNT3A, BCAR1, CTLA4, GRB2, MNDA, ITK, MAPK1, BMX, NFKBIA, TEC, NFKB1, TNFAIP3, LIMK1, VAV2, SRC, PRKCE, MYO1G, HCK, PTK2, FGR, PLPP4, IRF8, BCL3, ZP3, CD81, IRF2BP2, SYVN1, WNT4, CLEC4G, IL4R, IL9R, MPL, BCL10, FCER1G, IL2RB, CD27, CSF2RB, LIG4, MLH1, ERCC1, UNG, RNF168, SANBR, MSH6, STAT6, LFNG, NOTCH2, C17orf99, ST3GAL1, PTX3, SFTPA1, LBP, C4B, MBL2, HLA-G, LRRC8A, GATA3, SHLD3, SHLD1, SHLD2, PMS2, MSH3, IGKV4-1, LOC100287723, LOC100289053, IGKV1D-13, LOC96610, IGLV4-60, IGLV3-19, LOC91316, LOC100290557, IGLV2-23, IGJ, OSBPL10, CYAT1, LOC100293440, GNG7, IGLL3, MGC29506, IGLL5, TXNDC5, DERL3, MUTED, IGHV3-48, IGKV1-5, PPAP2C, KCNG2, SLC5A4, CAV1, TEK, TMEM37, GP1BB, SLC16A14, ICAM2, SLC44A1, CCR10, CHRM1, CLPTM1L, KCNN3, HM13, GPR25, KCNH1, TXNDC15, SDC1, DRD4, KRTCAP2, TRAM2, SCARB2, AMIGO3",28.67,26.5,1,-0
B CELL,IMMUNOGLOBULIN MEDIATED RESPONSE,0.328,155,318,0,1650,465,"HHEX, SPI1, TLR4, CD79B, CD79A, BANK1, MS4A1, CXCR5, CD22, CR2, PAX5, CD19, TPD52, FCGR2B, MEF2C, BTK, SYK, VAV1, PLCG2, PTPN6, BCL2, TICAM1, TBC1D10C, CHRNA4, CD40, GAPT, PHB1, CHRNA7, LAX1, RASGRP1, HSPD1, ZAP70, CD86, CHRNB2, TXLNA, BST2, AKAP17A, EPHB2, HDAC4, GPR183, CH25H, PTPRC, TOP2B, IFNA8, PIK3R1, RAG1, MSH2, RAG2, IL2RG, ADGRG3, FZD9, EP300, PTPRJ, YY1, STAT5B, PTPN2, LYL1, CEBPG, JAK3, BCL6, KIT, SP3, ZBTB7A, NFAM1, ITGA4, CD40LG, IL10, IL11, TCF3, RBPJ, FOSL2, IFNE, FLT3, VCAM1, ADAM17, IL9, CDH17, SPNS2, BAX, CAMLG, IL7R, RC3H1, SOS2, SOS1, NCKAP1L, CASP3, PRKDC, CD70, ABL1, IL7, PRKCD, CTPS1, CD38, WNT3A, BCAR1, CTLA4, GRB2, MNDA, ITK, MAPK1, BMX, NFKBIA, TEC, NFKB1, TNFAIP3, LIMK1, VAV2, SRC, PRKCE, MYO1G, HCK, PTK2, FGR, PLPP4, IRF8, BCL3, ZP3, CD81, IRF2BP2, SYVN1, WNT4, CLEC4G, IL4R, IL9R, MPL, BCL10, FCER1G, IL2RB, CD27, CSF2RB, LIG4, MLH1, ERCC1, UNG, RNF168, SANBR, MSH6, STAT6, LFNG, NOTCH2, C17orf99, ST3GAL1, PTX3, SFTPA1, LBP, C4B, MBL2, HLA-G, LRRC8A, GATA3, SHLD3, SHLD1, SHLD2, PMS2, MSH3",9.39,33.33,1,-0
B CELL,INFLAMMATION,0.023,12,461,43,1650,228,"TNFSF13, TLR4, TNF, IL5RA, RASGRP1, IL10, RBPJ, FOSL2, NFKBIA, TNFAIP3, FCER1G, NOTCH2",0.73,5.26,3.640760359671976e-52,51.438807906041944
B CELL,INNATE IMMUNE SYSTEM,0.063,101,372,1136,1650,4113,"TNFSF13, HHEX, SPI1, TLR4, CCR7, LYN, TNF, BTLA, CD24, CR2, HLA-DOB, CD19, FCGR2B, IGKC, MEF2C, ALOX5, HLA-DOA, HLA-DQA1, BTK, CIITA, TLR10, GPR18, INPP5D, SYK, VAV1, PLCG2, PTPN6, NEDD4, DUSP6, LY86, DLL1, EGF, HLA-DPB1, EDNRB, LHCGR, NMBR, IL5RA, IMPG2, CXADR, HLA-DPA1, HLA-DRA, ITGB6, HLA-DMA, CXCR4, TICAM1, CD40, PHB1, RASGRP1, HSPD1, ZAP70, CD86, BST2, HDAC4, GPR183, CH25H, PTPRC, IFNA8, EP300, STAT5B, CEBPG, JAK3, BCL6, KIT, SP3, NFAM1, ITGA4, IL10, RBPJ, FOSL2, IFNE, VCAM1, ADAM17, BAX, NCKAP1L, PRKDC, PRKCD, CD38, CTLA4, MNDA, ITK, NFKBIA, NFKB1, TNFAIP3, SRC, PRKCE, HCK, FGR, IRF8, BCL3, MPL, BCL10, FCER1G, IL2RB, CSF2RB, NOTCH2, PTX3, LBP, C4B, MBL2, HLA-G, GATA3",6.12,2.46,9.191914263784258e-272,271.0365940351182
B CELL,LYMPHOCYTE,0.036,19,454,51,1650,210,"BLK, CD200, VPREB3, CD79A, LOC100130458, BANK1, TCL1A, IGHD, EBF1, FCER2, CD19, MEF2C, ICOSLG, GAB1, FAM150B, VPREB1, KIT, CTLA4, PTK2",1.15,9.05,2.51088345449183e-55,54.60017344509104
B CELL,MACROPHAGE,0.014,7,466,28,1650,105,"TLR4, SYK, PLCG2, EDNRB, TICAM1, PRKCE, LBP",0.42,6.67,1.1224900457496737e-39,38.94981750163436
B CELL,MAST CELL,0.01,5,468,19,1650,72,"BTK, SYK, RASGRP1, STAT5B, KIT",0.3,6.94,5.2367225093784436e-30,29.280940438479384
B CELL,MONOCYTE,0.025,20,453,317,1650,1029,"TNFSF13, HHEX, SPI1, TLR4, LYN, ALOX5, BTK, SYK, DUSP6, LY86, CD86, BCL6, NFAM1, PRKCD, MNDA, HCK, FGR, MPL, FCER1G, PTX3",1.21,1.94,2.370499086872289e-198,197.62516020763732
B CELL,MYELOID CELL,0.013,7,466,68,1650,225,"HHEX, TLR4, EGF, CD86, BCL6, IL10, FCER1G",0.42,3.11,5.554521581340676e-79,78.25535334149926
B CELL,NEUTROPHIL,0.016,10,463,141,1650,462,"BTK, SYK, VAV1, CXADR, ADAM17, NCKAP1L, PRKCD, MPL, FCER1G, LBP",0.61,2.16,6.744238462384182e-128,127.17106708235326
B CELL,NK CELL,0.025,15,458,124,1650,432,"GPR18, PTPN6, DLL1, RASGRP1, ZAP70, PTPRC, IFNA8, STAT5B, CEBPG, KIT, SP3, IFNE, ITK, IL2RB, GATA3",0.91,3.47,4.17927818328619e-112,111.37889872015926
B CELL,SIGNALING,0.029,17,456,112,1650,387,"LIF, CCR7, TNF, DUSP6, LHCGR, IMPG2, CXCR4, IFNA8, BCL6, IL10, IL7R, NFKBIA, NFKB1, TNFAIP3, HCK, BCL3, PTX3",1.03,4.39,1.457701024281623e-102,101.83633154105186
B CELL,T CELL,0.096,79,394,353,1650,1500,"SPI1, TLR4, CCR7, TNF, MS4A1, TCF4, CD24, CR2, SP140, BTK, CD37, SYK, VAV1, PLCG2, PTPN6, BCL2, BCL11B, CXADR, CD52, HLA-DRA, PHB1, CHRNA7, RASGRP1, HSPD1, ZAP70, CD86, GPR183, PTPRC, IFNA8, PIK3R1, RAG1, RAG2, IL2RG, PTPRJ, STAT5B, PTPN2, JAK3, BCL6, KIT, SP3, ITGA4, CD40LG, IL10, FOSL2, IFNE, VCAM1, ADAM17, SPNS2, BAX, IL7R, RC3H1, NCKAP1L, CASP3, PRKDC, CD70, ABL1, IL7, CTPS1, BCAR1, CTLA4, ITK, MAPK1, TEC, SRC, MYO1G, BCL3, CD81, WNT4, CLEC4G, IL4R, BCL10, FCER1G, IL2RB, CD27, LIG4, STAT6, LFNG, GATA3, CAV1",4.79,5.27,4.811037272821476e-156,155.31776127845018
