Cond1,Cond2,jaccard_distance,Shared,NotShared_cond1,NotShared_cond2,Total_Genes_Cond1,Total_Genes_Cond2,Genes_Names,Percentage_Shared_Cond1,Percentage_Shared_Cond2,pvalue,-log(p)
DENDRITIC CELL,LEUKOCYTES,0.179,240,1093,11,7419,810,"MAP3K8, IL23A, CCL5, CD83, NFKBID, FUT7, CTGF, TNF, VCAM1, ICAM1, SAMSN1, RELB, NFKB2, EBI3, BCL3, IL1RN, NFKBIA, BIRC3, PRKCD, LTB, TNIP3, CD1E, CD1B, CD1C, CD1A, CSF1R, IL1R2, CSF2RA, ANPEP, CD9, IL1R1, CD38, DDX58, IRF7, PLSCR1, C1QC, IFIH1, SERPING1, DDX60, C2, IGKC, RSAD2, CXCL2, RGL1, CD86, RIN2, SLAMF8, IL4I1, ATP1B1, PLXDC2, CSF2RB, TNFAIP6, HESX1, CCL8, MX2, DOCK4, PDGFRL, MGST1, IFNGR2, IFIT3, IFIT2, IFIT1, HLX, CCL20, ST3GAL6, RBM47, IFI27, DAPK1, PRRG4, PDGFC, PARP9, LAMP3, CXCL11, DSE, IL18, BCL2A1, FAM20C, PRKAR2B, HERC5, SIGLEC1, ATF3, CLEC10A, B3GNT5, PGD, JAG1, FCER1A, EMILIN2, CLEC5A, CA2, CTSB, ADAM9, RRAGD, TACSTD2, CTSL1, GGTA1, DAB2, CAPG, AGPAT9, TM2D2, PPAP2B, SLC7A8, KMO, CD58, LRFN4, CCRL2, CD151, ADAM12, TM7SF4, SLC36A1, PDCD1LG2, PSEN2, GPR137B, C19orf28, TMEM158, PTGFRN, SLC6A6, SPINT2, LRP11, FZD5, TSPAN33, DIRC2, ALCAM, GJB2, GPNMB, ABHD12, EMP1, TFRC, HLA-DQB1, LHFPL2, COLEC12, SUCNR1, TMEM51, TGFA, SLC38A6, ITPRIPL2, CALCRL, CLDN23, ATP1B2, GRINA, FPR3, RAMP1, TREM2, SRD5A3, SLC41A2, FAM70A, LAMP2, ABCC3, DENND1B, P2RY6, NRP1, NRP2, CXCL16, CRIM1, GPR157, OLR1, CD274, SDC2, SLCO2B1, SLC7A11, ABCA6, MSR1, ACE, AGPAT3, SLC1A3, HLA-DQA1, TNFRSF11A, SERINC5, IGSF6, TSPAN15, STAB1, IFNGR1, FZD1, CCDC90A, LPCAT2, SFXN3, ENG, MFSD1, TTYH3, TMEM144, PLXND1, SLC27A3, ITGAX, SLC26A11, PLD3, HLA-DMA, CH25H, ANTXR2, SLC31A2, TNFSF13B, LY75, CD80, TMCC3, SLCO5A1, F11R, TTYH2, ITGB8, RNF144B, SGPP2, NINJ1, CD40, IL3RA, TMEM140, KITLG, SLC43A2, IL13RA1, IFI6, LRRC32, ELOVL7, EREG, TYROBP, SIRPA, TLR8, CCR1, SPI1, NLRP12, ALOX5, IL1B, LY96, LTBR, CXCR2, CCR2, CXCR1, STAT4, CCL4, IFNG, CXCR4, NOTCH2, GPR183, RBPJ, CCR7, SERPINB9, PIK3CG, HLA-DRB3, IRF8, HMGB1, LAG3, PDE4B, ADORA2A /// CYTSA, GCH1, HS3ST3B1",3.23,29.63,8.04115413247395e-9,8.094681613267403
DENDRITIC CELL,CELLULAR ADAPTIVE IMMUNE SYSTEM,0.056,38,425,213,1506,810,"CCR7, CCL5, STAT4, IFNG, TNF, ATF3, TYROBP, VCAM1, IL23A, SPI1, LAG3, LTB, F2R, CD83, FUT7, DOCK8, IFNGR1, IFNGR2, CD86, PIK3CG, CD80, PSEN1, CD1C, GPR183, MAP3K8, JAG1, CCL20, KITLG, CD151, PDE4B, NFKBID, DENND1B, HLA-DRB3, HMGB1, RELB, BCL3, CCR2, FCER1A",2.52,4.69,5.4117590775797945e-137,136.2666615457046
DENDRITIC CELL,COMPLEMENT,0.021,6,36,245,153,810,"SERPING1, C1QC, C1QB, C1QA, C2, FPR3",3.92,0.74,6.3366656884413375e-40,39.1981392048986
DENDRITIC CELL,EOSINOPHIL,0.015,4,247,18,810,66,"CCL5, CCL8, FCER1A, CCL4",0.49,6.06,1.5401646991826483e-24,23.81243283492873
DENDRITIC CELL,HUMORAL ADAPTIVE IMMUNE SYSTEM,0.035,28,223,544,810,1785,"CD86, HLA-DQA1, CD83, TNF, VCAM1, NFKB2, BCL3, NFKBIA, PRKCD, CD38, IGKC, CXCL2, CSF2RB, CCL8, CCL20, FCER1A, HLA-DMA, CH25H, CD40, CCR2, CXCR4, CCR7, GPR183, ALOX5, SPI1, NOTCH2, RBPJ, IRF8",3.46,1.57,4.3649788593259156e-167,166.3600178553491
DENDRITIC CELL,IMMUNOGLOBULIN MEDIATED RESPONSE,0.036,14,237,141,810,465,"CD86, VCAM1, BCL3, NFKBIA, PRKCD, CD38, CSF2RB, CH25H, CD40, GPR183, SPI1, NOTCH2, RBPJ, IRF8",1.73,3.01,4.2518986381440795e-91,90.37141709725773
DENDRITIC CELL,INFLAMMATION,0.077,22,229,33,810,228,"TYROBP, TNF, IL1RN, NFKBIA, BIRC3, TNFAIP6, CCL20, STAB1, CD80, ADORA2A /// CYTSA, STAT4, CCL4, IFNG, GCH1, SERPINB9, HS3ST3B1, IL1B, PDE4B, CXCR2, HMGB1, NOTCH2, RBPJ",2.72,9.65,8.580685506989978e-29,28.06647801518035
DENDRITIC CELL,INNATE IMMUNE SYSTEM,0.203,251,0,986,810,4113,"ITGAX, SIRPA, OLR1, TYROBP, CD58, C1QC, C1QB, C1QA, CD86, HLA-DQB1, LY96, TLR8, HLA-DQA1, MAP3K8, IL23A, CCL5, CD83, NFKBID, FUT7, CTGF, TNF, VCAM1, ICAM1, SAMSN1, RELB, NFKB2, EBI3, BCL3, IL1RN, NFKBIA, BIRC3, PRKCD, LTB, TNIP3, CD1E, CD1B, CD1C, CD1A, CSF1R, IL1R2, CSF2RA, ANPEP, CD9, IL1R1, CD38, DDX58, IRF7, PLSCR1, IFIH1, SERPING1, DDX60, C2, IGKC, RSAD2, CXCL2, RGL1, RIN2, SLAMF8, IL4I1, ATP1B1, PLXDC2, CSF2RB, TNFAIP6, HESX1, CCL8, MX2, DOCK4, PDGFRL, MGST1, IFNGR2, IFIT3, IFIT2, IFIT1, HLX, CCL20, ST3GAL6, RBM47, IFI27, DAPK1, PRRG4, PDGFC, PARP9, LAMP3, CXCL11, DSE, IL18, BCL2A1, FAM20C, PRKAR2B, HERC5, SIGLEC1, ATF3, CLEC10A, B3GNT5, PGD, JAG1, FCER1A, EMILIN2, CLEC5A, CA2, CTSB, ADAM9, RRAGD, TACSTD2, CTSL1, GGTA1, DAB2, CAPG, AGPAT9, TM2D2, PPAP2B, SLC7A8, KMO, LRFN4, CCRL2, CD151, ADAM12, TM7SF4, SLC36A1, PDCD1LG2, PSEN2, GPR137B, C19orf28, TMEM158, PTGFRN, SLC6A6, SPINT2, LRP11, FZD5, TSPAN33, DIRC2, ALCAM, GJB2, GPNMB, ABHD12, EMP1, TFRC, LHFPL2, COLEC12, SUCNR1, TMEM51, TGFA, SLC38A6, ITPRIPL2, CALCRL, CLDN23, ATP1B2, GRINA, FPR3, RAMP1, TREM2, SRD5A3, SLC41A2, FAM70A, LAMP2, ABCC3, DENND1B, P2RY6, NRP1, NRP2, CXCL16, CRIM1, GPR157, CD274, SDC2, SLCO2B1, SLC7A11, ABCA6, MSR1, ACE, AGPAT3, SLC1A3, TNFRSF11A, SERINC5, IGSF6, TSPAN15, STAB1, IFNGR1, FZD1, CCDC90A, LPCAT2, SFXN3, ENG, MFSD1, TTYH3, TMEM144, PLXND1, SLC27A3, SLC26A11, PLD3, HLA-DMA, CH25H, ANTXR2, SLC31A2, TNFSF13B, LY75, CD80, TMCC3, SLCO5A1, F11R, TTYH2, ITGB8, RNF144B, SGPP2, NINJ1, CD40, IL3RA, TMEM140, KITLG, SLC43A2, IL13RA1, IFI6, LRRC32, ELOVL7, EREG, ADORA2A /// CYTSA, STAT4, CCL4, IFNG, GCH1, SERPINB9, HS3ST3B1, IL1B, PDE4B, CCR2, CXCR2, CCR1, CXCR4, CXCR1, CCR7, HMGB1, GPR183, PIK3CG, F2R, ALOX5, CDC42, EPS8, DOCK8, NLRP12, HLA-DRB3, ARHGEF5, SPI1, BATF2, TGFBR2, NOTCH2, LTBR, PSEN1, RBPJ, LAG3, ZBTB46, IRF8",30.99,6.1,1,-0
DENDRITIC CELL,LYMPHOCYTE,0.019,6,245,64,810,210,"IL23A, CTGF, CD1B, CD9, RGL1, CCL4",0.74,2.86,2.074483133835825e-60,59.683090091763816
DENDRITIC CELL,MACROPHAGE,0.007,2,249,33,810,105,"CCL5, CCR2",0.25,1.9,3.9247366313544435e-41,40.406189481182956
DENDRITIC CELL,MAST CELL,0.015,4,247,20,810,72,"FCER1A, KITLG, SERPINB9, PIK3CG",0.49,5.56,1.1619118681820796e-26,25.93482681223292
DENDRITIC CELL,MONOCYTE,0.081,44,207,293,810,1029,"ITGAX, SIRPA, TYROBP, CD86, LY96, TLR8, CCL5, IL1RN, PRKCD, CSF1R, IL1R2, CSF2RA, ANPEP, RIN2, PLXDC2, CCL8, MGST1, IFNGR2, CCL20, ST3GAL6, RBM47, PDGFC, PGD, FCER1A, EMILIN2, AGPAT9, IGSF6, STAB1, FZD1, MFSD1, PLXND1, SLC31A2, TNFSF13B, NINJ1, IL13RA1, CCL4, IL1B, CCR2, CXCR2, CCR1, ALOX5, NLRP12, SPI1, LTBR",5.43,4.28,8.416858891976164e-107,106.0748499536783
DENDRITIC CELL,MYELOID CELL,0.032,10,241,65,810,225,"CD86, TLR8, IL23A, IL1RN, CSF1R, CLEC5A, SLC1A3, IGSF6, CCR2, CCR1",1.23,4.44,2.6977330813212783e-57,56.56900102243425
DENDRITIC CELL,NEUTROPHIL,0.039,15,236,136,810,462,"TYROBP, CCL5, PRKCD, CXCL2, CCL8, CCL20, ACE, CCL4, PDE4B, CCR2, CXCR2, CXCR1, HMGB1, PIK3CG, NLRP12",1.85,3.25,4.6069443297943775e-88,87.33658703571979
DENDRITIC CELL,NK CELL,0.013,5,246,134,810,432,"CCL5, STAT4, CCL4, PIK3CG, LAG3",0.62,1.16,8.358747259997633e-99,98.07785880615401
DENDRITIC CELL,SIGNALING,0.111,38,213,91,810,387,"C1QB, MAP3K8, IL23A, CCL5, CD83, TNF, ICAM1, NFKB2, BCL3, NFKBIA, DDX58, IRF7, PLSCR1, IFIH1, SERPING1, DDX60, RSAD2, CXCL2, TNFAIP6, CCL8, IFIT1, CCL20, PARP9, CXCL11, BCL2A1, HERC5, FCER1A, CCRL2, ADORA2A /// CYTSA, CCL4, IFNG, GCH1, HS3ST3B1, IL1B, PDE4B, CCR1, CXCR4, CCR7",4.69,9.82,1.2973739733128998e-52,51.88693481872271
DENDRITIC CELL,T CELL,0.056,36,215,396,810,1500,"TYROBP, CD86, MAP3K8, IL23A, CCL5, CD83, NFKBID, FUT7, TNF, VCAM1, RELB, BCL3, LTB, CD1C, CCL20, ATF3, JAG1, FCER1A, CD151, DENND1B, CD80, KITLG, STAT4, IFNG, PDE4B, CCR2, CCR7, HMGB1, GPR183, PIK3CG, F2R, DOCK8, HLA-DRB3, SPI1, PSEN1, LAG3",4.44,2.4,3.149670918021687e-134,133.50173481952888
EOSINOPHIL,ADAPTIVE IMMUNE SYSTEM,0.018,17,932,5,3078,66,"CCL5, XCL1, CCL4, BTK, CCL2, MPL, CCL3, CCL18, CCL7, CX3CL1, CCL4L1, CCL1, CCL3L1, CCL8, CCL24, CCL23, FCER1A",0.55,25.76,4.041250127515209e-9,8.393484268676916
EOSINOPHIL,IMMUNE SYSTEM,0.006,1,132,21,399,66,BTK,0.25,1.52,5.41041425404748e-25,24.26676948140742
EOSINOPHIL,ANTIMICROBIAL,0.062,5,58,17,189,66,"LGALS3, CCL1, XCL1, CCL8, CCL18",2.65,7.58,2.5947441843941936e-13,12.585905452760588
EOSINOPHIL,ANTIVIRAL & IFN,0.097,15,132,7,453,66,"CCL5, CCL4, CCL8, CCL1, CCL3, CCL4L1, CCL3L1, CCL18, CCL2, CX3CL1, XCL1, CCL24, CCL7, CCL23, FCER1A",3.31,22.73,4.805018361176392e-7,6.318304948444478
EOSINOPHIL,ARPP,0.052,17,302,5,1053,66,"BTK, CCL5, CCL2, LGALS3, CCL3, CCL3L1, CX3CL1, CCL18, CCL1, CCL7, XCL1, CCL23, CCL4, CCL4L1, CCL24, CCL8, MPL",1.61,25.76,9.129345900624917e-7,6.039560337682082
EOSINOPHIL,B CELL,0.004,2,471,20,1650,66,"BTK, MPL",0.12,3.03,1.1545820860257638e-33,32.93757518510217
EOSINOPHIL,LEUKOCYTES,0.013,17,1316,5,7419,66,"CCL5, CCL8, FCER1A, LGALS3, BTK, XCL1, CCL4, CCL2, CCL1, CCL7, CCL23, CCL18, CCL4L1, CCL24, CCL3L1, CCL3, CX3CL1",0.23,25.76,7.424496436895559e-10,9.1293329968382
EOSINOPHIL,CELLULAR ADAPTIVE IMMUNE SYSTEM,0.015,7,456,15,1506,66,"CCL5, XCL1, CCL2, CX3CL1, CCL3, BTK, FCER1A",0.46,10.61,1.7918289348301093e-23,22.74670345461003
EOSINOPHIL,COMPLEMENT,0,0,42,22,153,66,,0,0,1.244594594321748e-17,16.904972089629336
EOSINOPHIL,DENDRITIC CELL,0.015,4,247,18,810,66,"CCL5, CCL8, FCER1A, CCL4",0.49,6.06,1.5401646991826483e-24,23.81243283492873
EOSINOPHIL,HUMORAL ADAPTIVE IMMUNE SYSTEM,0.015,9,13,563,66,1785,"CCL18, LGALS3, CCL1, CCL8, CCL2, XCL1, FCER1A, BTK, MPL",13.64,0.5,3.769642135988353e-21,20.4236998767816
EOSINOPHIL,IMMUNOGLOBULIN MEDIATED RESPONSE,0.011,2,20,153,66,465,"BTK, MPL",3.03,0.43,2.3936157868141102e-24,23.62094555946752
EOSINOPHIL,INFLAMMATION,0.013,1,21,54,66,228,CCL4,1.52,0.44,7.568712124759684e-18,17.120978012797632
EOSINOPHIL,INNATE IMMUNE SYSTEM,0.018,22,0,1215,66,4113,"SCG2, CCL5, CCL4, CCL18, CCL3, LGALS3, CCL23, CCL1, CCL8, CCL4L1, CCL2, CCL7, CX3CL1, CCL3L1, XCL1, CCL24, VAMP2, VAMP7, FCER1A, BTK, MPL, EPX",33.33,0.53,1,-0
EOSINOPHIL,LYMPHOCYTE,0.011,1,21,69,66,210,CCL4,1.52,0.48,9.958511879718214e-20,19.00180555421807
EOSINOPHIL,MACROPHAGE,0.075,4,18,31,66,105,"CCL5, CCL3, LGALS3, CCL2",6.06,3.81,1.1320451209509385e-10,9.94613626273301
EOSINOPHIL,MAST CELL,0.045,2,20,22,66,72,"FCER1A, BTK",3.03,2.78,2.623450747887231e-10,9.581127084742402
EOSINOPHIL,MONOCYTE,0.053,18,4,319,66,1029,"CCL5, CCL4, CCL18, CCL3, LGALS3, CCL23, CCL1, CCL8, CCL4L1, CCL2, CCL7, CX3CL1, CCL3L1, XCL1, CCL24, FCER1A, BTK, MPL",27.27,1.75,1.3215265042076712e-5,4.878924122342554
EOSINOPHIL,MYELOID CELL,0,0,22,75,66,225,,0,0,2.8989180079240216e-22,21.53776406791845
EOSINOPHIL,NEUTROPHIL,0.116,18,4,133,66,462,"CCL5, CCL4, CCL18, CCL3, LGALS3, CCL23, CCL1, CCL8, CCL4L1, CCL2, CCL7, CX3CL1, CCL3L1, XCL1, CCL24, VAMP7, BTK, MPL",27.27,3.9,3.1625553447185305e-4,3.4999618655961906
EOSINOPHIL,NK CELL,0.025,4,18,135,66,432,"CCL5, CCL4, XCL1, VAMP7",6.06,0.93,3.839328360744677e-20,19.415744743011246
EOSINOPHIL,SIGNALING,0.071,10,12,119,66,387,"CCL5, CCL4, CCL18, CCL23, CCL1, CCL8, CCL2, CCL7, XCL1, FCER1A",15.15,2.58,8.117536723650212e-12,11.090575737953877
EOSINOPHIL,T CELL,0.013,6,16,426,66,1500,"CCL5, CCL3, CCL2, XCL1, FCER1A, BTK",9.09,0.4,7.774635154199479e-25,24.109319982267134
HUMORAL ADAPTIVE IMMUNE SYSTEM,ADAPTIVE IMMUNE SYSTEM,0.499,506,443,66,3078,1785,"CD52, CCR7, HLA-DRA, ZAP70, ITK, IL2RG, PTPRC, IL7R, RASGRP1, BCL11B, XCL1, CD28, GNLY, CD27, GATA3, MS4A1, SP140, CD24, BCL2, TNF, IL2RB, CXADR, CD40LG, ITGA4, VCAM1, CD37, SPI1, PTPN6, JAK3, TCF4, CTLA4, FCER2, IGHD, BLK, CD200, KIT, CD79A, MEF2C, GAB1, BANK1, CD19, PTK2, EBF1, ICOSLG, VPREB1, VPREB3, LOC100130458, TCL1A, FAM150B, TNFSF13, LIF, HHEX, CEBPE, CBFA2T3, LTA, TLR4, LYN, STAP1, CD72, TSPAN13, BCL11A, C13orf18, KIAA0125, CD79B, P2RX5, BTLA, AFF3, PPAPDC1B, IGHM, LOC90925, FCRLA, SPIB, FAM129C, ABCB4, FCRL1, FCRL5, KLHL14, CXCR5, PCDH9, RALGPS2, CD22, IGH@, IGKV3-20, MACROD2, PNOC, ADAM28, LOC283663, CR2, PAX5, E2F5, PLEKHG1, PKIG, FCRL2, IGLJ3, HLA-DOB, PTPRK, IGHA1, LOC642838, LOC642424, IGK@, TPD52, CDK14, BLNK, FCGR2B, CELSR1, DENND5B, PAWR, CD180, LOC100130100, POU2AF1, FAM30A, KLF8, LOC652493, IGKC, LOC284749, FCRL3, TBC1D9, ALOX5, CD69, FAIM3, IGLV1-44, IGL@, HLA-DOA, HLA-DQA1, BTK, CPNE5, CIITA, TLR10, IGHG1, GPR18, LY9, INPP5D, SYK, PIK3CD, VAV1, PLCG2, PIK3R5, PIK3R3, RAC2, JAM3, NEDD4, GAB2, DUSP6, NR3C2, NRXN3, LY86, HBEGF, LOC144481, NR4A1, DLL1, LOC100288911, NR4A3, IGKV4-1, LOC100287723, LOC100289053, IGKV1D-13, ITM2C, LOC96610, IGLV4-60, IGLV3-19, LOC91316, LOC100290557, IGLV2-23, IGJ, OSBPL10, CYAT1, LOC100293440, TNFRSF17, GNG7, IGLL3, MGC29506, IGLL5, TXNDC5, DERL3, MUTED, IGHV3-48, IGKV1-5, SSPN, AVPR1A, KCNE4, HEPACAM2, GYPA, SEMA4B, EGF, GPR37, C11orf87, USH2A, PPP1R3A, OR12D3, POPDC3, DCC, SLC12A1, GP5, CDH5, SLITRK6, HLA-DPB1, PCDHA3, TRHDE, GHR, TAS2R13, FLRT2, TPTE, TMEM100, GYPE, PLD4, ADAM7, KCNMB3, GPR6, CSPG4, SYT2, ROBO2, FREM2, TRPC1, GPR116, TMEM47, SCN3A, NPY1R, LPPR4, NOX4, PDZK1IP1, CCR9, GABBR1, EDNRB, GJC1, LHCGR, PCDHB8, NT5E, PDPN, PCDHB4, CLDN8, LRRTM4, HRH4, NMBR, NCAM2, GRM5, TM4SF20, IL5RA, JAM2, IL28RA, MC3R, F2RL3, ASTN1, MOGAT2, SLC26A7, SLC24A1, TACR3, IL13RA2, IMPG2, LRRC19, TMEFF2, PCDH10, BTC, GPR98, AGTR1, TMEM133, UGT2A3, OR11A1, CSMD1, TRPC7, CCR6, GABRA5, PLP1, CLCA4, CNR1, EPHA3, SLC30A10, SGCE, CHRNB4, PCDHB10, PCDHB16, PCDHB15, PCDHB14, CADM2, GPR85, SLC6A15, GPR87, NLGN1, SLC13A1, OR1E1, GABRB1, TAAR2, HHLA2, SLC17A6, CNTNAP3, SLC6A16, HLA-DPA1, ABCA8, OR2J2, CHL1, TMEM156, SLC5A7, OR2W1, LPHN3, LPHN2, LRP1B, PCDH20, KCND2, SLC44A5, ITGB6, NLGN4Y, CHRM2, PTH2R, HEPH, BAI3, PTPRR, SELE, FAM26F, SCN1A, HTR1E, HLA-DMA, PPAP2C, KCNG2, SLC5A4, CAV1, TEK, TMEM37, GP1BB, SLC16A14, ICAM2, SLC44A1, CCR10, CHRM1, CLPTM1L, KCNN3, HM13, GPR25, KCNH1, TXNDC15, SDC1, DRD4, KRTCAP2, TRAM2, SCARB2, AMIGO3, LGR4, TRHR, GHSR, P2RY14, SLC38A11, C4orf34, CXCR4, TMEM56, KCNJ16, SLC26A3, MUC15, OR1G1, TAS2R7, HVCN1, GABRE, CLDN17, SORCS3, LINGO1, NKAIN4, TAS2R10, GRAMD1C, TNFRSF13B, ADAM2, GLP2R, ABL1, STAT5B, MYO1G, HLA-E, RAG1, BCL10, TEC, C17orf99, GPR183, IFNA8, BMX, LAX1, CD86, TFEB, CD81, TFE3, IFNE, CLEC4G, TICAM1, TBC1D10C, CHRNA4, CD40, GAPT, PHB1, CHRNA7, HSPD1, CHRNB2, TXLNA, BST2, AKAP17A, EPHB2, HDAC4, CH25H, TOP2B, PIK3R1, MSH2, RAG2, ADGRG3, FZD9, EP300, PTPRJ, YY1, PTPN2, LYL1, CEBPG, BCL6, SP3, ZBTB7A, NFAM1, IL10, IL11, TCF3, RBPJ, FOSL2, FLT3, ADAM17, IL9, CDH17, SPNS2, BAX, CAMLG, RC3H1, SOS2, SOS1, NCKAP1L, CASP3, PRKDC, CD70, IL7, PRKCD, CTPS1, CD38, WNT3A, BCAR1, GRB2, MNDA, MAPK1, NFKBIA, NFKB1, TNFAIP3, LIPA, HOXB4, CD83, LIG4, FCER1G, LIMK1, VAV2, SRC, PRKCE, HCK, FGR, PLPP4, IRF8, NFKB2, BCL3, CCL2, ZP3, IRF2BP2, SYVN1, WNT4, IL4R, IL9R, MPL, CSF2RB, MLH1, ERCC1, UNG, RNF168, SANBR, MSH6, STAT6, CCL18, CCL1, CCL8, CCL20, LFNG, NOTCH2, ST3GAL1, PTX3, SFTPA1, LBP, C4B, MBL2, HLA-G, LGALS1, LRRC8A, SHLD3, SHLD1, SHLD2, PMS2, MSH3, NKX2-5, EPB42, CDKN2B, PBX1, NKX3-2, NKX2-3, CACNB4, KMT2A, CXCL12, DEFA4, DEFA1, B2M, PSMB10, SLC11A1, CCR2, NOTCH1, FCER1A",16.44,28.35,1.291004639912231e-17,16.88907219686243
HUMORAL ADAPTIVE IMMUNE SYSTEM,IMMUNE SYSTEM,0.052,35,98,537,399,1785,"NCKAP1L, HLA-DPB1, NFKBIA, PTPN6, HLA-DRA, CCR7, TLR10, FCER1G, BTLA, FGR, CD86, ZAP70, MNDA, DUSP6, CTLA4, TLR4, CD24, HCK, LYN, INPP5D, ITK, HLA-DQA1, MEF2C, SYK, PTPRC, HLA-DOA, HLA-DOB, HLA-DMA, HLA-DPA1, CD19, BTK, ITGA4, IRF8, HLA-G, HLA-E",8.77,1.96,2.7867443536601213e-88,87.55490287014106
HUMORAL ADAPTIVE IMMUNE SYSTEM,ANTIMICROBIAL,0.11,63,0,509,189,1785,"FAM3A, TAC1, DEFA4, CAMP, CXCL14, CXCL12, DEFA1, FAU, CCL20, DEFB130A, TOR2A, CXCL1, DEFA3, DEFB131A, REG1B, H2BC10, ROMO1, NTS, CXCL2, HAMP, S100A12, CXCL8, CXCL9, REG3A, GNLY, RNASE3, RPS19, BPI, REG3G, RPL30, DEFB1, LGALS3, PF4V1, H2BC12L, SPAG11A, CCL1, HTN1, DEFB103A, DEFA5, DEFA6, B2M, SPAG11B, CXCL6, CXCL3, NPPB, CXCL5, XCL1, CCL8, RPL39, HTN3, S100A7, DCD, F2, ADM, CCL18, PRTN3, BCL3, LYZ, CST9LP1, CST9, SLC11A1, PRSS3, AZU1",33.33,3.53,1,-0
HUMORAL ADAPTIVE IMMUNE SYSTEM,ANTIVIRAL & IFN,0.03,21,126,551,453,1785,"PHB1, NMBR, MBL2, CCL8, CCL1, CCL18, CCL2, XCL1, TLR4, IRF8, CCL20, HLA-DPA1, IFNE, HDAC4, IFNA8, HCK, FCER1A, PTX3, BCL3, LHCGR, IMPG2",4.64,1.18,2.668948412327043e-117,116.57365982053929
HUMORAL ADAPTIVE IMMUNE SYSTEM,ARPP,0.096,78,241,494,1053,1785,"NCKAP1L, HLA-DPB1, NFKBIA, PTPN6, HLA-DRA, CCR7, TLR10, FCER1G, BTLA, FGR, CD86, ZAP70, MNDA, DUSP6, CTLA4, TLR4, CD24, HCK, LYN, INPP5D, ITK, HLA-DQA1, MEF2C, SYK, PTPRC, HLA-DOA, HLA-DOB, HLA-DMA, HLA-DPA1, CD19, BTK, ITGA4, IRF8, HLA-G, HLA-E, MBL2, LBP, CCR2, CXCR4, GPR183, ALOX5, ITGB6, HAMP, SLC11A1, TICAM1, PRKCE, PLCG2, CCL2, LGALS3, AZU1, EDNRB, LIPA, CCL18, CCL1, CTSG, XCL1, CCL20, RPS19, CCL8, S100A12, MPL, REG3G, HSPD1, SPI1, NOTCH2, RBPJ, TNFAIP3, PHB1, EP300, SRC, BCL10, CD40, BST1, BCL6, TNF, LY86, BST2, PSMB10",7.41,4.37,4.8076494023205725e-138,137.31806721076182
HUMORAL ADAPTIVE IMMUNE SYSTEM,B CELL,0.827,473,0,99,1650,1785,"TNFSF13, LIF, HHEX, CEBPE, CBFA2T3, LTA, SPI1, TLR4, CCR7, LYN, TNF, STAP1, BLK, CD72, TSPAN13, BCL11A, C13orf18, KIAA0125, CD200, CD79B, VPREB3, CD79A, P2RX5, BTLA, AFF3, PPAPDC1B, IGHM, LOC90925, FCRLA, SPIB, FAM129C, ABCB4, LOC100130458, FCRL1, BANK1, MS4A1, FCRL5, TCF4, KLHL14, CXCR5, PCDH9, RALGPS2, CD22, TCL1A, CD24, IGH@, IGKV3-20, IGHD, MACROD2, EBF1, PNOC, ADAM28, LOC283663, CR2, PAX5, E2F5, PLEKHG1, FCER2, PKIG, FCRL2, IGLJ3, HLA-DOB, PTPRK, CD19, IGHA1, LOC642838, LOC642424, IGK@, TPD52, CDK14, BLNK, SP140, FCGR2B, CELSR1, DENND5B, PAWR, CD180, LOC100130100, POU2AF1, FAM30A, KLF8, LOC652493, IGKC, MEF2C, LOC284749, FCRL3, TBC1D9, ALOX5, CD69, FAIM3, IGLV1-44, IGL@, HLA-DOA, HLA-DQA1, BTK, CPNE5, CIITA, TLR10, IGHG1, GPR18, LY9, CD37, INPP5D, SYK, PIK3CD, VAV1, PLCG2, PIK3R5, PIK3R3, RAC2, PTPN6, JAM3, NEDD4, GAB2, BCL2, DUSP6, NR3C2, NRXN3, LY86, ICOSLG, HBEGF, LOC144481, NR4A1, GAB1, DLL1, LOC100288911, NR4A3, FAM150B, BCL11B, VPREB1, SSPN, AVPR1A, KCNE4, HEPACAM2, GYPA, SEMA4B, EGF, GPR37, C11orf87, USH2A, PPP1R3A, OR12D3, POPDC3, DCC, SLC12A1, GP5, CDH5, SLITRK6, HLA-DPB1, PCDHA3, TRHDE, GHR, TAS2R13, FLRT2, TPTE, TMEM100, GYPE, PLD4, ADAM7, KCNMB3, GPR6, CSPG4, SYT2, ROBO2, FREM2, TRPC1, GPR116, TMEM47, SCN3A, NPY1R, LPPR4, NOX4, PDZK1IP1, CCR9, GABBR1, EDNRB, GJC1, LHCGR, PCDHB8, NT5E, PDPN, PCDHB4, CLDN8, LRRTM4, HRH4, NMBR, NCAM2, GRM5, TM4SF20, IL5RA, JAM2, IL28RA, MC3R, F2RL3, ASTN1, MOGAT2, SLC26A7, SLC24A1, TACR3, IL13RA2, IMPG2, LRRC19, TMEFF2, ITM2C, PCDH10, BTC, GPR98, AGTR1, TMEM133, UGT2A3, OR11A1, CSMD1, TRPC7, CCR6, GABRA5, PLP1, CLCA4, CNR1, EPHA3, SLC30A10, SGCE, CHRNB4, PCDHB10, PCDHB16, PCDHB15, PCDHB14, CADM2, GPR85, SLC6A15, GPR87, NLGN1, SLC13A1, OR1E1, GABRB1, CXADR, TAAR2, HHLA2, SLC17A6, CNTNAP3, SLC6A16, HLA-DPA1, ABCA8, CD52, OR2J2, CHL1, TMEM156, SLC5A7, OR2W1, LPHN3, LPHN2, HLA-DRA, LRP1B, PCDH20, KCND2, SLC44A5, ITGB6, NLGN4Y, CHRM2, PTH2R, HEPH, BAI3, PTPRR, SELE, FAM26F, SCN1A, HTR1E, HLA-DMA, LGR4, TRHR, GHSR, P2RY14, SLC38A11, C4orf34, CXCR4, TMEM56, KCNJ16, SLC26A3, MUC15, OR1G1, TAS2R7, HVCN1, GABRE, CLDN17, SORCS3, TNFRSF17, LINGO1, NKAIN4, TAS2R10, GRAMD1C, TNFRSF13B, ADAM2, GLP2R, TICAM1, TBC1D10C, CHRNA4, CD40, GAPT, PHB1, CHRNA7, LAX1, RASGRP1, HSPD1, ZAP70, CD86, CHRNB2, TXLNA, BST2, AKAP17A, EPHB2, HDAC4, GPR183, CH25H, PTPRC, TOP2B, IFNA8, PIK3R1, RAG1, MSH2, RAG2, IL2RG, ADGRG3, FZD9, EP300, PTPRJ, YY1, STAT5B, PTPN2, LYL1, CEBPG, JAK3, BCL6, KIT, SP3, ZBTB7A, NFAM1, ITGA4, CD40LG, IL10, IL11, TCF3, RBPJ, FOSL2, IFNE, FLT3, VCAM1, ADAM17, IL9, CDH17, SPNS2, BAX, CAMLG, IL7R, RC3H1, SOS2, SOS1, NCKAP1L, CASP3, PRKDC, CD70, ABL1, IL7, PRKCD, CTPS1, CD38, WNT3A, BCAR1, CTLA4, GRB2, MNDA, ITK, MAPK1, BMX, NFKBIA, TEC, NFKB1, TNFAIP3, LIMK1, VAV2, SRC, PRKCE, MYO1G, HCK, PTK2, FGR, PLPP4, IRF8, BCL3, ZP3, CD81, IRF2BP2, SYVN1, WNT4, CLEC4G, IL4R, IL9R, MPL, BCL10, FCER1G, IL2RB, CD27, CSF2RB, LIG4, MLH1, ERCC1, UNG, RNF168, SANBR, MSH6, STAT6, LFNG, NOTCH2, C17orf99, ST3GAL1, PTX3, SFTPA1, LBP, C4B, MBL2, HLA-G, LRRC8A, GATA3, SHLD3, SHLD1, SHLD2, PMS2, MSH3, IGKV4-1, LOC100287723, LOC100289053, IGKV1D-13, LOC96610, IGLV4-60, IGLV3-19, LOC91316, LOC100290557, IGLV2-23, IGJ, OSBPL10, CYAT1, LOC100293440, GNG7, IGLL3, MGC29506, IGLL5, TXNDC5, DERL3, MUTED, IGHV3-48, IGKV1-5, PPAP2C, KCNG2, SLC5A4, CAV1, TEK, TMEM37, GP1BB, SLC16A14, ICAM2, SLC44A1, CCR10, CHRM1, CLPTM1L, KCNN3, HM13, GPR25, KCNH1, TXNDC15, SDC1, DRD4, KRTCAP2, TRAM2, SCARB2, AMIGO3",28.67,26.5,1,-0
HUMORAL ADAPTIVE IMMUNE SYSTEM,LEUKOCYTES,0.135,226,1107,346,7419,1785,"CD83, TNF, VCAM1, NFKB2, BCL3, NFKBIA, PRKCD, CD38, IGKC, CXCL2, CD86, CSF2RB, CCL8, CCL20, FCER1A, HLA-DQA1, HLA-DMA, CH25H, CD40, TNFSF13, LGALS3, HCK, LGALS1, S100A12, FGR, LYN, SYK, BST1, TLR4, LY86, BTK, FCER1G, SPI1, MNDA, ALOX5, SLC11A1, CXCL1, DUSP6, BCL6, PTX3, LYZ, HHEX, NFAM1, CCR2, IL10, EGF, CXCL12, XCL1, ZAP70, GNLY, IL2RB, ITK, RASGRP1, GPR18, DLL1, KIT, BANK1, MACROD2, VPREB1, VPREB3, CD19, CIITA, HLA-DRA, CDK14, DEFA4, DEFA1, CTSG, TCL1A, AZU1, LOC90925, BMX, JAM3, MEF2C, CD72, UNG, GAB1, PTK2, BPI, MSH2, CAMP, LOC100130458, EBF1, PRTN3, ICOSLG, PAX5, CCR9, BCL11B, HLA-DOA, CEBPE, RNASE3, CD22, FAM150B, CCL2, CCL1, CXCL3, CXCL5, CXCL6, CCL18, CXCL9, CXCR4, IL7R, LIF, CTLA4, FCER2, IGHD, BLK, CD200, CD79A, CD28, HLA-E, TAC1, B2M, DEFB1, SEMG2, H2BC10, DEFA3, RNASE4, WFDC13, DEFA6, WFDC11, H2BC12L, RPL39, WFDC3, PI3, FAU, DEFA5, ADM, WFDC9, SPRR2A, WFDC10B, NCR3LG1, FAM3A, BCAR1, LAX1, CXCL14, DEFB130A, TOR2A, DEFB131A, REG1B, ROMO1, NTS, HAMP, CXCL8, REG3A, RPS19, REG3G, RPL30, PF4V1, SPAG11A, HTN1, DEFB103A, SPAG11B, NPPB, HTN3, S100A7, DCD, F2, CST9LP1, CST9, PRSS3, JAM2, ITGA4, IFNA8, IL7, NOTCH2, GATA3, IFNE, BMI1, MS4A1, BCL2, PSMB10, TFEB, GPR183, TFE3, ST6GAL1, POU2F2, RBPJ, NOTCH1, RAG1, VAV1, IL2RG, HLA-DOB, HLA-DPA1, CCR7, CEBPG, CR2, PIK3R1, CXCR5, CCR10, CD79B, CD70, FCGR2B, IRF8, IL9, ITGB6, HLA-G, CD40LG, CLEC4G, IL4R, MYO1G, PRKDC, PRKCE, CD81, TEC, CTPS1, MBL2, LBP, C4B, C17orf99, BTLA, JAK3, BST2, SRC, BCL10, TNFRSF17, TICAM1, BAX, FLT3, SELE, SOS1, NKX2-3, PDPN, RC3H1, SPNS2, TNFAIP3, NFKB1",3.05,12.66,7.797112940440945e-205,204.10806617501942
HUMORAL ADAPTIVE IMMUNE SYSTEM,CELLULAR ADAPTIVE IMMUNE SYSTEM,0.109,102,361,470,1506,1785,"CD52, CCR7, HLA-DRA, ZAP70, ITK, IL2RG, PTPRC, IL7R, RASGRP1, BCL11B, XCL1, CD28, GNLY, CD27, GATA3, MS4A1, SP140, CD24, BCL2, TNF, IL2RB, CXADR, CD40LG, ITGA4, VCAM1, CD37, SPI1, PTPN6, JAK3, TCF4, ABL1, STAT5B, CLEC4G, SYK, CD81, CD83, HLA-E, LIG4, RAG2, CCL2, AZU1, NCKAP1L, BAX, HAMP, FOSL2, CD86, CHRNA7, HSPD1, VAV1, IFNE, IFNA8, CXCL12, DEFA4, GPR183, DEFA1, CAV1, SRC, LGALS1, KIT, PTPN2, LIPA, LFNG, PIK3R1, SP3, RAG1, ADAM17, PRKDC, WNT4, B2M, FCER1G, SPNS2, RC3H1, CASP3, IL7, MYO1G, CR2, CD70, CCL20, PSMB10, CTPS1, SLC11A1, BTK, PLCG2, MAPK1, CTLA4, BCL10, TEC, BCAR1, PTPRJ, IL4R, STAT6, TLR4, BCL3, CCR2, NOTCH1, PHB1, BCL6, KMT2A, CACNB4, PBX1, FCER1A, IL10",6.77,5.71,6.914035597070315e-165,164.1602683888128
HUMORAL ADAPTIVE IMMUNE SYSTEM,COMPLEMENT,0.007,4,38,568,153,1785,"C4B, CR2, MBL2, NCR3LG1",2.61,0.22,2.7291250598952086e-56,55.56397656268923
HUMORAL ADAPTIVE IMMUNE SYSTEM,DENDRITIC CELL,0.035,28,223,544,810,1785,"CD86, HLA-DQA1, CD83, TNF, VCAM1, NFKB2, BCL3, NFKBIA, PRKCD, CD38, IGKC, CXCL2, CSF2RB, CCL8, CCL20, FCER1A, HLA-DMA, CH25H, CD40, CCR2, CXCR4, CCR7, GPR183, ALOX5, SPI1, NOTCH2, RBPJ, IRF8",3.46,1.57,4.3649788593259156e-167,166.3600178553491
HUMORAL ADAPTIVE IMMUNE SYSTEM,EOSINOPHIL,0.015,9,13,563,66,1785,"CCL18, LGALS3, CCL1, CCL8, CCL2, XCL1, FCER1A, BTK, MPL",13.64,0.5,3.769642135988353e-21,20.4236998767816
HUMORAL ADAPTIVE IMMUNE SYSTEM,IMMUNOGLOBULIN MEDIATED RESPONSE,0.271,155,417,0,1785,465,"HHEX, SPI1, TLR4, CD79B, CD79A, BANK1, MS4A1, CXCR5, CD22, CR2, PAX5, CD19, TPD52, FCGR2B, MEF2C, BTK, SYK, VAV1, PLCG2, PTPN6, BCL2, CD27, BCL3, TICAM1, TBC1D10C, CHRNA4, CD40, GAPT, PHB1, CHRNA7, LAX1, RASGRP1, HSPD1, ZAP70, CD86, CHRNB2, TXLNA, BST2, AKAP17A, EPHB2, HDAC4, GPR183, CH25H, PTPRC, TOP2B, IFNA8, PIK3R1, RAG1, MSH2, RAG2, IL2RG, ADGRG3, FZD9, EP300, PTPRJ, YY1, STAT5B, PTPN2, LYL1, CEBPG, JAK3, BCL6, KIT, SP3, ZBTB7A, NFAM1, ITGA4, CD40LG, IL10, IL11, TCF3, RBPJ, FOSL2, IFNE, FLT3, VCAM1, ADAM17, IL9, CDH17, SPNS2, BAX, CAMLG, IL7R, RC3H1, SOS2, SOS1, NCKAP1L, CASP3, PRKDC, CD70, ABL1, IL7, PRKCD, CTPS1, CD38, WNT3A, BCAR1, CTLA4, GRB2, MNDA, ITK, MAPK1, BMX, NFKBIA, TEC, NFKB1, TNFAIP3, LIMK1, VAV2, SRC, PRKCE, MYO1G, HCK, PTK2, FGR, PLPP4, IRF8, NOTCH2, GATA3, ZP3, CD81, IRF2BP2, SYVN1, WNT4, CLEC4G, IL4R, IL9R, MPL, BCL10, FCER1G, IL2RB, CSF2RB, LIG4, MLH1, ERCC1, UNG, RNF168, SANBR, MSH6, STAT6, LFNG, C17orf99, ST3GAL1, PTX3, SFTPA1, LBP, C4B, MBL2, HLA-G, LRRC8A, SHLD3, SHLD1, SHLD2, PMS2, MSH3",8.68,33.33,1,-0
HUMORAL ADAPTIVE IMMUNE SYSTEM,INFLAMMATION,0.025,15,557,40,1785,228,"TNFSF13, TLR4, TNF, IL5RA, CCL20, RASGRP1, IL10, RBPJ, FOSL2, NFKBIA, TNFAIP3, NOTCH2, NOTCH1, FCER1G, LIPA",0.84,6.58,1.2104446391613562e-50,49.917055068639876
HUMORAL ADAPTIVE IMMUNE SYSTEM,INNATE IMMUNE SYSTEM,0.098,162,410,1075,1785,4113,"TNFSF13, HHEX, SPI1, TLR4, CCR7, LYN, TNF, BTLA, CD24, CR2, HLA-DOB, CD19, FCGR2B, IGKC, MEF2C, ALOX5, HLA-DOA, HLA-DQA1, BTK, CIITA, TLR10, GPR18, INPP5D, SYK, VAV1, PLCG2, PTPN6, NEDD4, DUSP6, LY86, DLL1, EGF, HLA-DPB1, EDNRB, LHCGR, NMBR, IL5RA, IMPG2, CXADR, HLA-DPA1, HLA-DRA, ITGB6, HLA-DMA, CXCR4, HLA-E, TAC1, DEFA4, B2M, DEFB1, CAMP, DEFA1, H2BC10, DEFA3, BPI, RNASE3, WFDC13, CTSG, DEFA6, WFDC11, H2BC12L, RPL39, WFDC3, PI3, FAU, DEFA5, WFDC9, WFDC10B, CXCL12, CCL20, CXCL1, DEFB131A, CXCL2, HAMP, S100A12, CXCL8, CXCL9, GNLY, RPS19, REG3G, LGALS3, PF4V1, CCL1, CXCL6, CXCL3, CXCL5, XCL1, CCL8, F2, CCL18, PRTN3, BCL3, LYZ, SLC11A1, AZU1, TICAM1, CD40, PHB1, RASGRP1, HSPD1, ZAP70, CD86, BST2, HDAC4, GPR183, CH25H, PTPRC, IFNA8, EP300, STAT5B, CEBPG, JAK3, BCL6, KIT, SP3, NFAM1, ITGA4, IL10, RBPJ, FOSL2, IFNE, VCAM1, ADAM17, BAX, NCKAP1L, PRKDC, PRKCD, CD38, CTLA4, MNDA, ITK, NFKBIA, NFKB1, TNFAIP3, SRC, PRKCE, HCK, FGR, IRF8, CCR2, NOTCH2, GATA3, CD83, PSMB10, CCL2, TFEB, BST1, NOTCH1, MPL, BCL10, FCER1G, IL2RB, CSF2RB, PTX3, LBP, C4B, MBL2, HLA-G, LGALS1, LIPA, PBX1, NFKB2, FCER1A",9.08,3.94,7.373648516501193e-254,253.1323175679751
HUMORAL ADAPTIVE IMMUNE SYSTEM,LYMPHOCYTE,0.032,20,552,50,1785,210,"BLK, CD200, VPREB3, CD79A, LOC100130458, BANK1, TCL1A, IGHD, EBF1, FCER2, CD19, MEF2C, ICOSLG, GAB1, FAM150B, VPREB1, KIT, CTLA4, PTK2, CD28",1.12,9.52,7.615906683295604e-58,57.11827838594423
